{
  "schemaVersion": "cautilus.claim_extraction_result.v1",
  "extractionInputRef": {
    "path": "extraction-input.json",
    "templateHash": "sha256:b922fd5d92510fd0161eb53f8f8829bb964de3113bed9a03498b4c75972b34ef"
  },
  "runtime": {
    "model": "claude-opus-4-8",
    "agent": "cautilus-agent-blind-extractor"
  },
  "claims": [
    {
      "summary": "The extraction seam mirrors the review seam: the binary emits a deterministic input packet, the agent does the model-backed work, and the binary validates and applies the result.",
      "excerpts": [
        {
          "path": "docs/contracts/claim-extraction-template.md",
          "line": 18,
          "verbatim": "the binary emits a deterministic input packet, the agent does the model-backed work, and the binary validates and applies the result",
          "primary": true
        },
        {
          "path": "docs/contracts/claim-extraction-template.md",
          "line": 246,
          "verbatim": "The seam is the `extraction-input` / `apply-extraction` command pair with versioned input and result packets",
          "primary": false
        }
      ],
      "recommendedProof": "deterministic",
      "verificationReadiness": "ready-for-proof",
      "claimAudience": "developer",
      "claimSemanticGroup": "Claim discovery and review",
      "primaryEpic": "D1-discovery",
      "supportingEpics": [
        "D1-discovery",
        "A2-curation-review"
      ],
      "edgeRationale": "A2-curation-review is supported because the agent doing the model-backed extraction work is the curation pass that drives structured review.",
      "unresolvedQuestions": []
    },
    {
      "summary": "discover claims extraction-input emits a cautilus.claim_extraction_input.v1 packet containing sources, content hashes, merged classification hints, embedded template plus hash, bounds, and output schema.",
      "excerpts": [
        {
          "path": "docs/contracts/claim-extraction-template.md",
          "line": 21,
          "verbatim": "discover claims extraction-input --repo-root . --output extraction-input.json",
          "primary": true
        },
        {
          "path": "docs/contracts/claim-extraction-template.md",
          "line": 23,
          "verbatim": "(sources + content hashes, merged classification hints,\n     embedded extraction template + template hash, bounds, output schema)",
          "primary": false
        }
      ],
      "recommendedProof": "deterministic",
      "verificationReadiness": "ready-for-proof",
      "claimAudience": "developer",
      "claimSemanticGroup": "Packets and reporting",
      "primaryEpic": "D1-discovery",
      "supportingEpics": [
        "D1-discovery"
      ],
      "unresolvedQuestions": []
    },
    {
      "summary": "discover claims apply-extraction emits a cautilus.claim_proof_plan.v1 packet with extractionMode agent, performing anchoring validation, unanchored-claim rejection, fingerprint computation, and binary-owned packet blocks.",
      "excerpts": [
        {
          "path": "docs/contracts/claim-extraction-template.md",
          "line": 34,
          "verbatim": "cautilus.claim_proof_plan.v1 with extractionMode: agent",
          "primary": true
        },
        {
          "path": "docs/contracts/claim-extraction-template.md",
          "line": 35,
          "verbatim": "(anchoring validation, unanchored-claim rejection,\n     fingerprint computation, binary-owned packet blocks)",
          "primary": false
        }
      ],
      "recommendedProof": "deterministic",
      "verificationReadiness": "ready-for-proof",
      "claimAudience": "developer",
      "claimSemanticGroup": "Packets and reporting",
      "primaryEpic": "D1-discovery",
      "supportingEpics": [
        "D1-discovery",
        "D2-review-refresh"
      ],
      "edgeRationale": "D2-review-refresh is supported because apply-extraction's fingerprint computation and binary-owned packet assembly underpin the deterministic review/refresh chain.",
      "unresolvedQuestions": []
    },
    {
      "summary": "The binary owns sourceInventory, sourceGraph, effectiveScanScope, git commit, and per-source content hashes in every mode.",
      "excerpts": [
        {
          "path": "docs/contracts/claim-extraction-template.md",
          "line": 39,
          "verbatim": "The binary owns `sourceInventory`, `sourceGraph`, `effectiveScanScope`, git commit, and per-source content hashes in every mode.",
          "primary": true
        }
      ],
      "recommendedProof": "deterministic",
      "verificationReadiness": "ready-for-proof",
      "claimAudience": "developer",
      "claimSemanticGroup": "Packets and reporting",
      "primaryEpic": "D1-discovery",
      "supportingEpics": [
        "D1-discovery"
      ],
      "unresolvedQuestions": []
    },
    {
      "summary": "The agent never assembles the proof-plan packet directly; apply-extraction composes the binary-owned skeleton with the validated agent result.",
      "excerpts": [
        {
          "path": "docs/contracts/claim-extraction-template.md",
          "line": 40,
          "verbatim": "The agent never assembles the proof-plan packet directly; `apply-extraction` composes the binary-owned skeleton with the validated agent result.",
          "primary": true
        }
      ],
      "recommendedProof": "deterministic",
      "verificationReadiness": "ready-for-proof",
      "claimAudience": "developer",
      "claimSemanticGroup": "Packets and reporting",
      "primaryEpic": "A1-orchestration",
      "supportingEpics": [
        "A1-orchestration",
        "D1-discovery"
      ],
      "edgeRationale": "D1-discovery is supported because the binary-owned skeleton composition is part of the discovery proof-plan packet assembly.",
      "unresolvedQuestions": []
    },
    {
      "summary": "Both new commands are deterministic and make no model calls, preserving the fixed decision that the binary does not call an LLM for claim discovery or review.",
      "excerpts": [
        {
          "path": "docs/contracts/claim-extraction-template.md",
          "line": 41,
          "verbatim": "Both new commands are deterministic and make no model calls, preserving the fixed decision that the binary does not call an LLM for claim discovery or review.",
          "primary": true
        },
        {
          "path": "docs/contracts/claim-extraction-template.md",
          "line": 253,
          "verbatim": "The binary makes no model calls; both new commands are deterministic.",
          "primary": false
        },
        {
          "path": "docs/contracts/claim-extraction-template.md",
          "line": 311,
          "verbatim": "Neither new command makes a model call.",
          "primary": false
        }
      ],
      "recommendedProof": "deterministic",
      "verificationReadiness": "ready-for-proof",
      "claimAudience": "developer",
      "claimSemanticGroup": "Claim discovery and review",
      "primaryEpic": "D1-discovery",
      "supportingEpics": [
        "D1-discovery",
        "D2-review-refresh"
      ],
      "edgeRationale": "D2-review-refresh is supported because the no-model-call determinism also covers the review/refresh commands' deterministic guarantee.",
      "unresolvedQuestions": []
    },
    {
      "summary": "Running agent extraction sits behind the workflow contract's Model-Spend Confirmation rule: scan-scope confirmation authorizes extraction-input, but a separate extraction-budget confirmation is required before the agent extracts.",
      "excerpts": [
        {
          "path": "docs/contracts/claim-extraction-template.md",
          "line": 43,
          "verbatim": "scan-scope confirmation authorizes `extraction-input`, but a separate extraction-budget confirmation is required before the Cautilus Agent actually extracts",
          "primary": true
        },
        {
          "path": "docs/contracts/claim-extraction-template.md",
          "line": 258,
          "verbatim": "Scan-scope confirmation does not authorize agent extraction; extraction needs its own budget confirmation, per the workflow contract's Model-Spend Confirmation rule.",
          "primary": false
        }
      ],
      "recommendedProof": "cautilus-eval",
      "recommendedEvalSurface": "dev/skill",
      "verificationReadiness": "needs-scenario",
      "claimAudience": "developer",
      "claimSemanticGroup": "Agent and skill workflow",
      "primaryEpic": "I1-bounded-improvement",
      "supportingEpics": [
        "I1-bounded-improvement",
        "A1-orchestration"
      ],
      "edgeRationale": "A1-orchestration is supported because the budget-confirmation gate is part of the agent workflow guardrails the Cautilus Agent owns.",
      "unresolvedQuestions": []
    },
    {
      "summary": "The extraction budget (source count, excerpt bounds, batching, stop reasons) is recorded in the applied packet.",
      "excerpts": [
        {
          "path": "docs/contracts/claim-extraction-template.md",
          "line": 44,
          "verbatim": "The extraction budget (source count, excerpt bounds, batching, stop reasons) is recorded in the applied packet.",
          "primary": true
        }
      ],
      "recommendedProof": "deterministic",
      "verificationReadiness": "ready-for-proof",
      "claimAudience": "developer",
      "claimSemanticGroup": "Packets and reporting",
      "primaryEpic": "I1-bounded-improvement",
      "supportingEpics": [
        "I1-bounded-improvement"
      ],
      "unresolvedQuestions": []
    },
    {
      "summary": "extraction-input honors the same explicit --adapter override as discover claims, so measurement dry-runs on read-only corpora apply a proposed adapter without writing to the scanned repo.",
      "excerpts": [
        {
          "path": "docs/contracts/claim-extraction-template.md",
          "line": 46,